{
  "id": "cost-furnace-filter-standard",
  "job": "Replace standard rectangular furnace filter (homeowner size)",
  "diyRange": { "min": 5, "max": 40 },
  "proRange": { "min": 50, "max": 150 },
  "currency": "USD",
  "source": "Retail filter price bands vary by MERV rating and brand; pro visit usually bundled with service call. Educational typical range only.",
  "asOfDate": "2026-01-01",
  "regionNote": "U.S. retail typical; specialty sizes and high-MERV filters cost more.",
  "confidence": "typical"
}
